id	name	element	description	imagepath
1	Eastern Air Temple	AIR	One of the two temples exclusively housing female airbenders.	@/../com/avatarduel/card/image/land/Eastern Air Temple.png
2	Western Water Temple	AIR	One of the two temples exclusively housing female airbenders.	@/../com/avatarduel/card/image/land/Western Air Temple.png
3	Southern Air Temple	AIR	One of the two temples exclusively housing male airbenders. Childhood home of Avatar Aang.	@/../com/avatarduel/card/image/land/Southern Air Temple.png
4	Northern Air Temple	AIR	One of the two temples exclusively housing male airbenders.	@/../com/avatarduel/card/image/land/Northern Air Temple.png
5	Foggy Swamp	WATER	Place for immigrants of the Southern Water Tribe with an extensive array of fauna and flora.	@/../com/avatarduel/card/image/land/Foggy Swamp.png
6	Spirit Oasis	WATER	A verdant and lush garden located in a cave in the Northern Water Tribe's capital city at the North Pole.	@/../com/avatarduel/card/image/land/Spirit Oasis.png
7	Northern Water Tribe	WATER	The largest division of its nation and is located on an island situated near the North Pole.	@/../com/avatarduel/card/image/land/Northern Water Tribe.png
8	Southern Water Tribe	WATER	Minor division of the Water Tribe. Its people are scattered in tiny villages and settlements located on an island by the South Pole.	@/../com/avatarduel/card/image/land/Southern Water Tribe.png
9	Si Wong Desert	EARTH	The largest desert in the world.	@/../com/avatarduel/card/image/land/Si Wong Desert.png
10	Ba Sing Se	EARTH	The monolithic capital of the Earth Kingdom.	@/../com/avatarduel/card/image/land/Ba Sing Se.png
11	Kyoshi Island	EARTH	"Famous as the birthplace of Avatar Kyoshi and as the home of the elite Kyoshi Warriors."	@/../com/avatarduel/card/image/land/Kyoshi Island.png
12	Omashu	EARTH	"The second largest city in the Earth Kingdom and the capital of one of its provinces ruled by King Bumi."	@/../com/avatarduel/card/image/land/Omashu.png
13	Fire Nation Capital	FIRE	The seat of the government for the Fire Nation	@/../com/avatarduel/card/image/land/Fire Nation Capital.png
14	Boiling Rock	FIRE	A massive Fire Nation prison.	@/../com/avatarduel/card/image/land/Boiling Rock.png
15	Sun Warriors' Ancient City	FIRE	Large, historic settlement located on an island north of the Fire Nation mainland.	@/../com/avatarduel/card/image/land/Sun Warriors' Ancient City.png
16	Fire Fountain City	FIRE	A large industrial city located in the Fire Nation.	@/../com/avatarduel/card/image/land/Fire Fountain City.png
17	Spirit Realm	ENERGY	a parallel plane of reality that coexists alongside the physical world inhabited by humans.	@/../com/avatarduel/card/image/land/Spirit Realm.png
18	Republic City	ENERGY	  the capital city of the United Republic of Nations as well as one of the largest and most modern cities in the world, with a population of millions.	@/../com/avatarduel/card/image/land/Republic City.png
19	Wulong Forest	ENERGY	  a geographical feature situated on the coast of the western United Republic of Nations, formerly the Earth Kingdom, and was the location of the final battle of the Hundred Year War between Fire Lord Ozai and Avatar Aang.	@/../com/avatarduel/card/image/land/Wulong Forest.png
20	Senlin Village	ENERGY	  The surrounding woodland is protected by a typically peaceful, though occasionally enraged, spirit known as Hei Bai.	@/../com/avatarduel/card/image/land/Senlin Village.png